[
  {
    "diagnostic_id": "DIAG-CHEM-001-01",
    "understanding_model_id": "UNDERSTANDING-MODEL-CHEM-001",
    "target_breakdown": "BREAKDOWN-CHEM-001-01",
    "question": "Probe Bonding & Definitions (QUESTION-FAMILY-CHEM-001): does the student show interpretation competence?",
    "purpose": "Find whether the student's difficulty is in interpretation rather than elsewhere.",
    "distinguishes": [
      "BREAKDOWN-CHEM-001-02",
      "BREAKDOWN-CHEM-001-03"
    ],
    "expected_evidence": [
      "correct response on the interpretation probe"
    ],
    "follow_up_conditions": [
      {
        "condition": "student answers incorrectly",
        "follow_up": "re-teach the interpretation sub-skill"
      }
    ],
    "source_or_rationale": "authored from QUESTION-FAMILY-CHEM-001 member distribution; see UNRES-CHEM-011 for image-dependent items",
    "confidence": "unknown"
  },
  {
    "diagnostic_id": "DIAG-CHEM-001-02",
    "understanding_model_id": "UNDERSTANDING-MODEL-CHEM-001",
    "target_breakdown": "BREAKDOWN-CHEM-001-02",
    "question": "Probe Bonding & Definitions (QUESTION-FAMILY-CHEM-001): does the student show execution competence?",
    "purpose": "Find whether the student's difficulty is in execution rather than elsewhere.",
    "distinguishes": [
      "BREAKDOWN-CHEM-001-01",
      "BREAKDOWN-CHEM-001-03"
    ],
    "expected_evidence": [
      "correct response on the execution probe"
    ],
    "follow_up_conditions": [
      {
        "condition": "student answers incorrectly",
        "follow_up": "re-teach the execution sub-skill"
      }
    ],
    "source_or_rationale": "authored from QUESTION-FAMILY-CHEM-001 member distribution; see UNRES-CHEM-011 for image-dependent items",
    "confidence": "unknown"
  },
  {
    "diagnostic_id": "DIAG-CHEM-001-03",
    "understanding_model_id": "UNDERSTANDING-MODEL-CHEM-001",
    "target_breakdown": "BREAKDOWN-CHEM-001-03",
    "question": "Probe Bonding & Definitions (QUESTION-FAMILY-CHEM-001): does the student show verification competence?",
    "purpose": "Find whether the student's difficulty is in verification rather than elsewhere.",
    "distinguishes": [
      "BREAKDOWN-CHEM-001-01",
      "BREAKDOWN-CHEM-001-02"
    ],
    "expected_evidence": [
      "correct response on the verification probe"
    ],
    "follow_up_conditions": [
      {
        "condition": "student answers incorrectly",
        "follow_up": "re-teach the verification sub-skill"
      }
    ],
    "source_or_rationale": "authored from QUESTION-FAMILY-CHEM-001 member distribution; see UNRES-CHEM-011 for image-dependent items",
    "confidence": "unknown"
  },
  {
    "diagnostic_id": "DIAG-CHEM-002-01",
    "understanding_model_id": "UNDERSTANDING-MODEL-CHEM-002",
    "target_breakdown": "BREAKDOWN-CHEM-002-01",
    "question": "Probe Stoichiometry (QUESTION-FAMILY-CHEM-002): does the student show interpretation competence?",
    "purpose": "Find whether the student's difficulty is in interpretation rather than elsewhere.",
    "distinguishes": [
      "BREAKDOWN-CHEM-002-02",
      "BREAKDOWN-CHEM-002-03"
    ],
    "expected_evidence": [
      "correct response on the interpretation probe"
    ],
    "follow_up_conditions": [
      {
        "condition": "student answers incorrectly",
        "follow_up": "re-teach the interpretation sub-skill"
      }
    ],
    "source_or_rationale": "authored from QUESTION-FAMILY-CHEM-002 member distribution; see UNRES-CHEM-011 for image-dependent items",
    "confidence": "unknown"
  },
  {
    "diagnostic_id": "DIAG-CHEM-002-02",
    "understanding_model_id": "UNDERSTANDING-MODEL-CHEM-002",
    "target_breakdown": "BREAKDOWN-CHEM-002-02",
    "question": "Probe Stoichiometry (QUESTION-FAMILY-CHEM-002): does the student show execution competence?",
    "purpose": "Find whether the student's difficulty is in execution rather than elsewhere.",
    "distinguishes": [
      "BREAKDOWN-CHEM-002-01",
      "BREAKDOWN-CHEM-002-03"
    ],
    "expected_evidence": [
      "correct response on the execution probe"
    ],
    "follow_up_conditions": [
      {
        "condition": "student answers incorrectly",
        "follow_up": "re-teach the execution sub-skill"
      }
    ],
    "source_or_rationale": "authored from QUESTION-FAMILY-CHEM-002 member distribution; see UNRES-CHEM-011 for image-dependent items",
    "confidence": "unknown"
  },
  {
    "diagnostic_id": "DIAG-CHEM-002-03",
    "understanding_model_id": "UNDERSTANDING-MODEL-CHEM-002",
    "target_breakdown": "BREAKDOWN-CHEM-002-03",
    "question": "Probe Stoichiometry (QUESTION-FAMILY-CHEM-002): does the student show verification competence?",
    "purpose": "Find whether the student's difficulty is in verification rather than elsewhere.",
    "distinguishes": [
      "BREAKDOWN-CHEM-002-01",
      "BREAKDOWN-CHEM-002-02"
    ],
    "expected_evidence": [
      "correct response on the verification probe"
    ],
    "follow_up_conditions": [
      {
        "condition": "student answers incorrectly",
        "follow_up": "re-teach the verification sub-skill"
      }
    ],
    "source_or_rationale": "authored from QUESTION-FAMILY-CHEM-002 member distribution; see UNRES-CHEM-011 for image-dependent items",
    "confidence": "unknown"
  },
  {
    "diagnostic_id": "DIAG-CHEM-003-01",
    "understanding_model_id": "UNDERSTANDING-MODEL-CHEM-003",
    "target_breakdown": "BREAKDOWN-CHEM-003-01",
    "question": "Probe Stoichiometry (QUESTION-FAMILY-CHEM-003): does the student show interpretation competence?",
    "purpose": "Find whether the student's difficulty is in interpretation rather than elsewhere.",
    "distinguishes": [
      "BREAKDOWN-CHEM-003-02",
      "BREAKDOWN-CHEM-003-03"
    ],
    "expected_evidence": [
      "correct response on the interpretation probe"
    ],
    "follow_up_conditions": [
      {
        "condition": "student answers incorrectly",
        "follow_up": "re-teach the interpretation sub-skill"
      }
    ],
    "source_or_rationale": "authored from QUESTION-FAMILY-CHEM-003 member distribution; see UNRES-CHEM-011 for image-dependent items",
    "confidence": "unknown"
  },
  {
    "diagnostic_id": "DIAG-CHEM-003-02",
    "understanding_model_id": "UNDERSTANDING-MODEL-CHEM-003",
    "target_breakdown": "BREAKDOWN-CHEM-003-02",
    "question": "Probe Stoichiometry (QUESTION-FAMILY-CHEM-003): does the student show execution competence?",
    "purpose": "Find whether the student's difficulty is in execution rather than elsewhere.",
    "distinguishes": [
      "BREAKDOWN-CHEM-003-01",
      "BREAKDOWN-CHEM-003-03"
    ],
    "expected_evidence": [
      "correct response on the execution probe"
    ],
    "follow_up_conditions": [
      {
        "condition": "student answers incorrectly",
        "follow_up": "re-teach the execution sub-skill"
      }
    ],
    "source_or_rationale": "authored from QUESTION-FAMILY-CHEM-003 member distribution; see UNRES-CHEM-011 for image-dependent items",
    "confidence": "unknown"
  },
  {
    "diagnostic_id": "DIAG-CHEM-003-03",
    "understanding_model_id": "UNDERSTANDING-MODEL-CHEM-003",
    "target_breakdown": "BREAKDOWN-CHEM-003-03",
    "question": "Probe Stoichiometry (QUESTION-FAMILY-CHEM-003): does the student show verification competence?",
    "purpose": "Find whether the student's difficulty is in verification rather than elsewhere.",
    "distinguishes": [
      "BREAKDOWN-CHEM-003-01",
      "BREAKDOWN-CHEM-003-02"
    ],
    "expected_evidence": [
      "correct response on the verification probe"
    ],
    "follow_up_conditions": [
      {
        "condition": "student answers incorrectly",
        "follow_up": "re-teach the verification sub-skill"
      }
    ],
    "source_or_rationale": "authored from QUESTION-FAMILY-CHEM-003 member distribution; see UNRES-CHEM-011 for image-dependent items",
    "confidence": "unknown"
  },
  {
    "diagnostic_id": "DIAG-CHEM-004-01",
    "understanding_model_id": "UNDERSTANDING-MODEL-CHEM-004",
    "target_breakdown": "BREAKDOWN-CHEM-004-01",
    "question": "Probe Bonding (QUESTION-FAMILY-CHEM-004): does the student show interpretation competence?",
    "purpose": "Find whether the student's difficulty is in interpretation rather than elsewhere.",
    "distinguishes": [
      "BREAKDOWN-CHEM-004-02",
      "BREAKDOWN-CHEM-004-03"
    ],
    "expected_evidence": [
      "correct response on the interpretation probe"
    ],
    "follow_up_conditions": [
      {
        "condition": "student answers incorrectly",
        "follow_up": "re-teach the interpretation sub-skill"
      }
    ],
    "source_or_rationale": "authored from QUESTION-FAMILY-CHEM-004 member distribution; see UNRES-CHEM-011 for image-dependent items",
    "confidence": "unknown"
  },
  {
    "diagnostic_id": "DIAG-CHEM-004-02",
    "understanding_model_id": "UNDERSTANDING-MODEL-CHEM-004",
    "target_breakdown": "BREAKDOWN-CHEM-004-02",
    "question": "Probe Bonding (QUESTION-FAMILY-CHEM-004): does the student show execution competence?",
    "purpose": "Find whether the student's difficulty is in execution rather than elsewhere.",
    "distinguishes": [
      "BREAKDOWN-CHEM-004-01",
      "BREAKDOWN-CHEM-004-03"
    ],
    "expected_evidence": [
      "correct response on the execution probe"
    ],
    "follow_up_conditions": [
      {
        "condition": "student answers incorrectly",
        "follow_up": "re-teach the execution sub-skill"
      }
    ],
    "source_or_rationale": "authored from QUESTION-FAMILY-CHEM-004 member distribution; see UNRES-CHEM-011 for image-dependent items",
    "confidence": "unknown"
  },
  {
    "diagnostic_id": "DIAG-CHEM-004-03",
    "understanding_model_id": "UNDERSTANDING-MODEL-CHEM-004",
    "target_breakdown": "BREAKDOWN-CHEM-004-03",
    "question": "Probe Bonding (QUESTION-FAMILY-CHEM-004): does the student show verification competence?",
    "purpose": "Find whether the student's difficulty is in verification rather than elsewhere.",